{
  "captured_at": "2026-08-13T00:48:46.401769Z",
  "documentation_path": "source-quickstart",
  "environment": {
    "architecture": "x86_64",
    "clean_start": true,
    "os_family": "ubuntu-24.04",
    "product_version": "0.9.1",
    "revision": {
      "kind": "git-commit",
      "value": "549ef03017c776f23fc968881b346aa685356274"
    },
    "ros_distro": "jazzy"
  },
  "evidence": {
    "manifest_sha256": "ac76a60728160f615dc28dd9889661b31a62508f5d69488a6a199c01b3cc0d16",
    "receipt_sha256": "542208a9ea1ee643689d782e0a5e797bb779cb820576ebf88fd72c801f3cd771"
  },
  "input": {
    "dataset_class": "fixed-public",
    "dataset_id": "mid360-public-zenodo-14841855",
    "download_bytes": 517088133
  },
  "measurements": {
    "active_operator_time_sec": null,
    "command_count": 1,
    "output_bytes": 131739648,
    "peak_disk_bytes": 3570200576,
    "wall_time_sec": 1382.082,
    "workflow_download_bytes": 727627936
  },
  "operator_class": "maintainer",
  "outcome": {
    "diagnosis_status": "success",
    "failure_stage": "none",
    "finding_codes": [],
    "manifest_status": "succeeded",
    "receipt_status": "PASS",
    "runner_exit_code": 0,
    "status": "PASS",
    "undocumented_manual_steps": 0,
    "verifier_status": "PASS"
  },
  "privacy": {
    "contains_exact_command": false,
    "contains_operator_identity": false,
    "contains_private_paths": false,
    "review_before_sharing": true
  },
  "schema_uri": "https://rsasaki0109.github.io/lidar_slam_ros2/schemas/onboarding-trial-v1.schema.json",
  "schema_version": 1,
  "trial_id": "g0-source-jazzy-20260813-runtime-a"
}
